Text,Label
I'd like to know the least crowded  activesg gym this coming sun.,1
Tell me the quietest  activesg during 9pm.,1
I'd like to know what the least crowded  centre is on weekends at 4pm.,1
Tell me the quietest  during 7am.,1
What's which  centre is the least full?,1
Do you happen to know the  with the lowest crowd at 1600.,1
I'd appreciate knowing the  gym with the lowest number of people.,1
I'd appreciate knowing the quietest  centre for thursday around 8am.,1
Would you mind telling me the quietest  activesg gym for tues around 0700.,1
Tell me the  activesg with the lowest capacity at 6pm on sunday.,1
May i know what the quietest  gym is.,1
May i know which  is the least packed on wed?,1
Which  centre is usually the least packed on tue?,1
I'd appreciate knowing what the least crowded  activesg is on monday at 1700.,1
Which  activesg gym is the least crowded?,1
Which  centre is typically the least packed on weekend at 8pm?,1
Tell me the quietest  gym during 1800.,1
Would you mind telling me what the quietest  activesg is on sun.,1
Tell me the least busy  gym on weekday.,1
Can i find out which  centre is the has the lowest capacity on sun at 2pm?,1
Give me the quietest  activesg gym.,1
Do you know which  is the least busy on thur?,1
Can you tell me the  with the lowest traffic.,1
I'm trying to find out what the least crowded  activesg gym is on monday at 8pm.,1
Could you share what the quietest  is.,1
I'm trying to find out which  centre is the least packed on sunday?,1
Would you mind telling me the  gym with the lowest number of people on thurs.,1
Give me the quietest  activesg gym for weekday.,1
Which  centre is typically the least packed on thur at 11am?,1
What's which  gym is the least busy on tuesday at 11am?,1
I'd like to know the  activesg gym with the lowest number of people on friday.,1
Tell me the least busy  activesg on sunday.,1
I'd like to know what the least crowded  activesg is on tuesday at 7am.,1
Just wondering about what the quietest  activesg gym is.,1
Which  centre is usually the least packed on monday?,1
Would you mind telling me which  gym is the least busy on thurs at 0800?,1
May i know which  gym is the has the lowest crowd on mon at 1100?,1
Just wondering about what the least crowded  is on tue at 1900.,1
I'd like to know what the least crowded  activesg gym is on sunday at 1900.,1
Tell me the  gym with the lowest crowd at 9pm on sun.,1
Can you tell me what the least crowded  is on sunday at 1400.,1
Which  centre is typically the least packed on saturday at 1300?,1
Just wondering about the quietest  for wed around 2100.,1
What's the  activesg with the lowest traffic on tuesday.,1
What's the  gym with the lowest traffic?,1
Do you know the quietest  activesg gym for thurs around 8pm.,1
Tell me the least busy  activesg on sunday.,1
Do you know what the least crowded  centre is on thurs at 0700.,1
What's which  centre is the has the lowest crowd on weekend at 3pm?,1
Is it possible to know the least crowded  activesg gym this coming wednesday.,1
What's the  centre with the lowest number of people?,1
Tell me the quietest  activesg gym during 1600.,1
Any idea about the quietest  for sun around 2000.,1
Can i find out the quietest  gym for fri around 8am.,1
What's what the least packed  activesg is around 12pm.,1
Which  is the least crowded?,1
Would you mind telling me what the least packed  is around 12pm.,1
What's what the quietest  gym is on tuesday.,1
What's which  gym tends to be the least packed.,1
Would you mind telling me what the quietest  centre is on mon.,1
Just wondering about the least busy  activesg currently.,1
Tell me the  activesg with the lowest traffic at 7am on tues.,1
Any idea about which  gym is the most quiet on weekdays?,1
Do you happen to know which  activesg is the has the lowest capacity on weekend at 1400?,1
Give me the quietest  activesg.,1
Do you happen to know the  gym with the lowest capacity on wed.,1
I'm trying to find out the  gym with the lowest capacity on thurs.,1
Any idea about what the quietest  activesg is on wednesday.,1
Tell me the  gym with the lowest capacity at 1700 on mon.,1
I'd like to know what the least packed  activesg gym is around 1300.,1
Tell me the  activesg with the lowest capacity at 0700 on sat.,1
Could you share which  activesg gym is the least busy?,1
Which  is the least crowded?,1
Can you tell me which  is the least packed?,1
Which  gym is typically the least packed on tuesday at 12pm?,1
I'd like to know what the least packed  gym is around 0700.,1
May i know the  activesg with the lowest capacity on mon.,1
Can you tell me which  centre tends to be the least packed.,1
Could you share the  activesg gym with the lowest number of people.,1
Which  centre is the least crowded?,1
Could you share which  activesg is the most quiet on sunday?,1
Do you happen to know which  centre tends to be the least packed.,1
Which  gym is typically the least packed on tuesday at 10am?,1
Do you know what the least crowded  is on sat at 1000.,1
Give me the quietest  centre.,1
Give me the quietest  gym for thurs.,1
I'm trying to find out which  activesg gym is the most quiet at 5pm?,1
Which  centre tends to be the least crowded at 8pm?,1
Which  activesg gym is typically the least packed on tuesday at 2100?,1
Would you mind telling me the quietest  for sun around 0900.,1
Can i find out what the least packed  activesg gym is around 9am.,1
Tell me which  is busiest at 7pm on Thurs.,2
Tell me the most packed  Centre around 8am.,2
What  usually has the biggest crowd at 12pm on Tue?,2
I'm trying to find out what  Gym has the most crowd around 1400.,2
Can I find out which  Centre tends to be full on Tues.,2
What's the busiest  Gym at 1400.,2
Could I get info on which  is the most packed?,2
What's the busiest  ActiveSG gym on Sun.,2
Tell me the most packed  Centre around 10pm.,2
Do you happen to know which  has the biggest crowd.,2
Which  Centre is the most packed on weekends?,2
Do you know the busiest  ActiveSG gym for Mon at 4pm.,2
Which  ActiveSG is most crowded on Wed at 5pm?,2
Which  ActiveSG is the most crowded?,2
Tell me the most packed  ActiveSG around 8am.,2
May I know which  ActiveSG is most crowded on Thur?,2
Tell me which  Centre is busiest on Wed.,2
Can you tell me which  ActiveSG tends to be most packed.,2
Which  ActiveSG gym tends to be full at 1600?,2
Do you happen to know which  ActiveSG tends to be most packed.,2
Which  Gym is the most crowded?,2
I'd appreciate knowing what  ActiveSG gym has the most number of people around 11am.,2
Give me the most packed  ActiveSG.,2
Can you tell me which  is most occupied on Thurs at 1500?,2
May I know the  with the highest number of people on Friday.,2
Tell me which  is busiest at 6pm on Saturday.,2
Which  is the most packed on Monday?,2
I'd appreciate knowing which  ActiveSG is the most occupied?,2
What's which  Gym tends to be full on Monday.,2
Give me the most crowded  ActiveSG this coming Fri.,2
Tell me which  Gym is busiest on Tue.,2
Tell me which  ActiveSG gym is busiest at 1pm on Thurs.,2
Do you know the most crowded  ActiveSG on weekdays at 3pm.,2
Is it possible to know the busiest  for Tuesday at 1pm.,2
What's the  Centre with the most number of people?,2
Any idea about what the most crowded  ActiveSG is.,2
What's the busiest  Gym on Monday.,2
May I know the most crowded  on Thursday at 1400.,2
Would you mind telling me which  Gym is most occupied at 8am?,2
Do you happen to know which  Gym usually sees the highest traffic at 1400.,2
Tell me which  Gym is busiest at 7am on Sunday.,2
I'm trying to find out the  with the highest crowd.,2
What  Gym usually has the biggest crowd at 5pm on Monday?,2
Tell me the most packed  ActiveSG around 7am.,2
Which  ActiveSG tends to be full at 2000?,2
Give me the most packed  Centre.,2
Do you happen to know the  ActiveSG gym with the highest traffic.,2
Give me the most crowded  ActiveSG this coming weekends.,2
Any idea about the busiest  ActiveSG gym on Tuesday.,2
I'm trying to find out which  Centre tends to be full on Wed.,2
Give me the most crowded  ActiveSG this coming Fri.,2
Could you share the busiest  Gym for Thurs at 9am.,2
Give me the most packed  ActiveSG gym.,2
Do you know which  ActiveSG usually sees the highest traffic at 5pm.,2
Tell me the most packed  around 1700.,2
Could you share which  Centre sees the highest traffic on Monday at 0700.,2
I'd appreciate knowing which  ActiveSG is most crowded on weekends?,2
Give me the most packed  ActiveSG gym.,2
Do you know what the most crowded  ActiveSG gym is.,2
Do you know which  ActiveSG sees the highest crowd on weekdays at 10pm.,2
Give me the busiest  ActiveSG at 0800.,2
Tell me which  Gym is busiest at 8am on Friday.,2
I'd appreciate knowing the busiest  ActiveSG on Tues.,2
Tell me which  Gym is busiest at 3pm on Wed.,2
I'd appreciate knowing which  ActiveSG is most occupied at 1500?,2
May I know the busiest  Gym currently.,2
Is it possible to know what the most crowded  ActiveSG gym is.,2
I'm trying to find out which  ActiveSG gym is the most busy?,2
Tell me which  is busiest on Thursday.,2
I'd appreciate knowing which  ActiveSG gym is most crowded on weekdays at 1000?,2
I'm trying to find out which  Gym is most packed on Tue at 1200?,2
Any idea about what  has the most crowd around 1700.,2
Do you know which  Centre is most occupied on weekend?,2
Do you happen to know which  ActiveSG is most crowded on weekdays?,2
Tell me the most packed  ActiveSG around 1300.,2
Which  Centre is most crowded on Mon at 5pm?,2
Is it possible to know what the most crowded  ActiveSG is.,2
Tell me which  ActiveSG gym is busiest on weekday.,2
Tell me the most packed  Gym around 4pm.,2
Is it possible to know what the crowd level is like across  on Monday.,2
Tell me which  ActiveSG gym is busiest on Sunday.,2
Do you happen to know which  ActiveSG tends to be full on Mon.,2
I'd appreciate knowing the  with the highest capacity.,2
Just wondering about which  ActiveSG gym is typically most packed on Monday at 10am.,2
Tell me which  Gym is busiest at 10am on weekend.,2
Do you happen to know which  ActiveSG tends to be most packed.,2
I'd like to know which  Gym tends to be full on Mon.,2
Just wondering about which  ActiveSG gym is typically most packed on Mon at 6pm.,2
Is it possible to know which  sees the highest traffic on Sunday at 1pm.,2
Can you tell me which  usually sees the highest traffic at 1300.,2
May I know the most crowded  Centre on weekends at 7pm.,2
I'm trying to find out which  ActiveSG is most full on Wed at 3pm?,2
Give me the most crowded  Centre this coming Mon.,2
Which  is the most crowded?,2
Just wondering about the busiest  Centre currently.,2
Is it possible to know the  ActiveSG gym with the highest capacity.,2
Can I find out which  ActiveSG gym tends to be full on Tues.,2
Any idea about the busiest  Gym for Tues at 6pm.,2
May I know the  ActiveSG with the highest number of people on Thurs.,2
I'd appreciate knowing which  ActiveSG sees the highest capacity on Fri at 1pm.,2
Which  ActiveSG gym is most crowded on Sat at 2200?,2
Tell me which  ActiveSG is busiest on Sat.,2
Tell me which  Centre is busiest at 8pm on Wednesday.,2
I'd appreciate knowing which  Gym has the biggest capacity.,2
Tell me the most packed  Centre around 8am.,2
Give me the most packed  ActiveSG.,2
Could I get info on which  Centre is most occupied on Sunday?,2
Which  Centre is most crowded on Sunday at 3pm?,2
Which  ActiveSG gym is most crowded on Friday at 0800?,2
Could I get info on the busiest  Gym on weekdays.,2
Could I get info on which  Centre is most busy on Tuesday at 1000?,2
Is it possible to know which  Centre sees the highest capacity on Thursday at 9am.,2
What  Gym usually has the biggest traffic at 5pm on weekday?,2
I'm trying to find out what the crowd level is like across  ActiveSG gym on weekend.,2
Could you share the most crowded  on Tue at 3pm.,2
Can I find out the busiest  at 2200.,2
What's the busiest  ActiveSG for Friday at 1100.,2
Tell me which  ActiveSG gym is busiest on weekend.,2
Could I get info on what the crowd level is like across  Gym on Mon.,2
I'm trying to find out which  is most crowded at 4pm?,2
Give me the most crowded  Gym this coming Fri.,2
Give me the most crowded  Gym this coming Monday.,2
Is it possible to know which  sees the highest crowd on Thur at 8pm.,2
Can I find out the busiest  ActiveSG currently.,2
What's which  Centre sees the highest capacity on Thur at 10pm.,2
I'd like to know which  is most packed on weekend?,2
I'd appreciate knowing the busiest  for Fri at 8pm.,2
Tell me which  Centre is busiest at 1100 on weekdays.,2
Which  ActiveSG gym tends to be full at 0900?,2
What's the  Gym with the most crowd?,2
Could you share the busiest  Centre on Thurs.,2
Do you happen to know which  tends to be full on Sun.,2
Which  ActiveSG is the most crowded?,2
Any idea about the  Centre with the highest traffic on weekdays.,2
Tell me which  ActiveSG is busiest at 1300 on weekdays.,2
Any idea about which  Centre tends to be most packed.,2
Tell me which  is busiest at 3pm on Tuesday.,2
Could you share what  ActiveSG gym has the most traffic around 10am.,2
I'd like to know what the crowd level is like across  ActiveSG gym on Friday.,2
I'd appreciate knowing the most crowded  ActiveSG on Monday at 1900.,2
Which  Gym is the most crowded?,2
Which  ActiveSG gym is most crowded on Fri at 7am?,2
Give me the most crowded  ActiveSG this coming weekdays.,2
Can you tell me the  ActiveSG with the highest traffic.,2
Any idea about which  Gym tends to be most packed.,2
Can you tell me the busiest  ActiveSG gym at 2pm.,2
Could you share the busiest  ActiveSG currently.,2
Could you share which  is most busy on Thurs?,2
Do you happen to know what the crowd level is like across  Centre on Wed.,2
What  ActiveSG usually has the biggest capacity at 11am on weekdays?,2
Give me the busiest  Gym at 1700.,2
Would you mind telling me which  Gym usually sees the highest capacity at 4pm.,2
Could you share which  ActiveSG sees the highest number of people on Tues at 9pm.,2
What's the  with the highest number of people on Tue.,2
Tell me which  ActiveSG gym is busiest at 1400 on Thur.,2
Can I find out what  Centre has the most traffic around 2pm.,2
Could you share which  ActiveSG gym is typically most packed on weekends at 9pm.,2
Can I find out which  ActiveSG is most packed on Thursday?,2
Could I get info on what  ActiveSG gym has the most number of people around 1100.,2
I'd appreciate knowing the busiest  for Wednesday at 2pm.,2
I'm trying to find out which  is most occupied on Sunday at 8am?,2
Do you know which  is most busy on Wednesday at 10am?,2
Tell me the most packed  Centre around 1800.,2
May I know which  Centre tends to be full on weekday.,2
Do you happen to know what the crowd level is like across  ActiveSG on Tues.,2
Can I find out which  Centre is most occupied at 1600?,2
I'm trying to find out which  Centre usually sees the highest crowd at 9pm.,2
Could you share the  ActiveSG with the highest number of people on Wed.,2
What's the  Gym with the most traffic?,2
Tell me which  Gym is busiest on weekend.,2
Give me the most packed  ActiveSG gym.,2
Which  Centre tends to be full at 5pm?,2
Give me the busiest  at 0800.,2
What's the  Gym with the most traffic?,2
Tell me which  ActiveSG gym is busiest at 10pm on Sunday.,2
I'm trying to find out which  ActiveSG gym tends to be most packed.,2
Give me the busiest  ActiveSG at 1500.,2
Which  ActiveSG gym tends to be full at 3pm?,2
Is it possible to know the busiest  Centre at 10am.,2
Give me the most crowded  Gym this coming Tuesday.,2
Do you happen to know what the crowd level is like across  ActiveSG gym on Sunday.,2
Could you share what the crowd level is like across  Centre on Sat.,2
Tell me the most packed  Gym around 7am.,2
Could I get info on which  Gym has the biggest number of people.,2
I'm trying to find out which  ActiveSG gym is most crowded at 1600?,2
Would you mind telling me the busiest  on Wed.,2
Just wondering about what  ActiveSG gym has the most capacity around 1100.,2
Would you mind telling me which  ActiveSG gym tends to be most packed.,2
Could you share which  ActiveSG sees the highest number of people on Fri at 9am.,2
Which  ActiveSG is the most crowded?,2
What  ActiveSG usually has the biggest crowd at 2200 on Thur?,2
Would you mind telling me which  Centre has the biggest capacity.,2
Which  ActiveSG gym tends to be full at 10am?,2
Could you share the  ActiveSG gym with the highest number of people on weekends.,2
Which  ActiveSG gym is the most crowded?,2
I'm trying to find out the busiest  on Fri.,2
Do you know which  ActiveSG tends to be most packed.,2
Give me the most packed  Centre.,2
Is it possible to know which  ActiveSG gym is the most crowded?,2
Could you share which  Gym tends to be most packed.,2
Do you know which  ActiveSG tends to be most packed.,2
Would you mind telling me which  Centre tends to be most packed.,2
Just wondering about what the most crowded  ActiveSG gym is.,2
Which  is the most crowded?,2
May I know what the crowd level is like across  ActiveSG gym on Tue.,2
Would you mind telling me the  ActiveSG gym with the highest number of people on Thur.,2
Tell me which  Centre is busiest at 6pm on Thurs.,2
Do you know what the crowd level is like across  Centre on Sun.,2
Just wondering about what the most crowded  is.,2
Could I get info on the busiest  Centre at 1000.,2
Do you know what  ActiveSG has the most crowd around 1800.,2
Do you happen to know which  ActiveSG tends to be full on Sunday.,2
Can I find out what  Centre has the most capacity around 6pm.,2
Any idea about the busiest  Gym on weekend.,2
Can I find out which  ActiveSG is typically most packed on Fri at 1600.,2
Can I find out what  ActiveSG gym has the most number of people around 1100.,2
Give me the most crowded  Gym this coming weekend.,2
Could I get info on which  Centre tends to be most packed.,2
What  Centre usually has the biggest crowd at 1400 on Friday?,2
Can I find out which  Centre tends to be most packed.,2
Do you happen to know what  ActiveSG has the most capacity around 2000.,2
I'd appreciate knowing the busiest  Gym at 7pm.,2
Do you know which  Centre tends to be full on Wed.,2
Would you mind telling me what the crowd level is like across  Gym on Sunday.,2
Is it possible to know which  Centre is most full on weekend at 9am?,2
I'm trying to find out the most crowded  Gym on Sun at 6pm.,2
Give me the most crowded  this coming Tues.,2
What's the  Centre with the most capacity?,2
Is it possible to know which  ActiveSG gym tends to be full on weekdays.,2
What  Gym usually has the biggest traffic at 2pm on Thurs?,2
Give me the most packed  Centre.,2
What's what the most crowded  Centre is.,2
Do you know which  Gym tends to be full on Sunday.,2
Any idea about which  ActiveSG gym tends to be most packed.,2
What's which  Gym tends to be most packed.,2
Which  Centre is the most packed on Mon?,2
Could you share the most crowded  ActiveSG on weekend at 1900.,2
Would you mind telling me which  Centre is the most occupied?,2
Just wondering about what the most crowded  is.,2
I'm trying to find out which  ActiveSG usually sees the highest crowd at 1800.,2
Give me the busiest  at 5pm.,2
Which  ActiveSG is the most packed on Mon?,2
Do you happen to know which  Centre has the biggest crowd.,2
Do you happen to know the  with the highest crowd on Saturday.,2
Could I get info on the busiest  ActiveSG gym on Fri.,2
Can you tell me which  ActiveSG has the biggest number of people.,2
Give me the busiest  Centre at 2100.,2
Any idea about the  ActiveSG with the highest number of people.,2
Could you share what the crowd level is like across  ActiveSG gym on Fri.,2
Can you tell me the busiest  Gym at 1100.,2
Can you tell me when it's not so busy at Senja-Cashew.,3
When is Jurong West Centre the has the lowest traffic on Thurs?,3
I'd like to know the best time slot to visit Clementi ActiveSG.,3
Can I find out what time Yio Chu Kang Centre usually gets the has the lowest traffic.,3
Can I find out when Bukit Gombak ActiveSG is the has the lowest capacity on Sun.,3
May I know when it's not so busy at Senja-Cashew ActiveSG gym.,3
What time is it best to go to Toa Payoh West CC ActiveSG if I want to avoid crowds?,3
When is Bukit Batok ActiveSG gym the least busy on Tuesday?,3
What time is it best to go to Bukit Gombak if I want to avoid crowds?,3
Could you suggest a good time to go to Kallang Basin Centre on Sunday when it's the least packed?,3
Just wondering about when Enabling Village is the least busy.,3
I'm trying to find out when it's not so busy at Jurong Lake Gardens Centre.,3
Is it possible to know when it's not so busy at Bukit Canberra.,3
Do you happen to know when Jurong West is the has the lowest crowd.,3
Would you mind telling me when Bishan Centre is the least occupied.,3
Could I get info on when Enabling Village ActiveSG is the least packed.,3
Do you happen to know what time Ang Mo Kio CC Gym gets the least busy on Tues.,3
Is it possible to know what time Toa Payoh West CC Gym usually gets the least busy.,3
What's when it's not so busy at Tampines Gym.,3
May I know what time Serangoon Central gets the least busy on Mon.,3
When is Yio Chu Kang ActiveSG gym the least occupied on Sat?,3
When does Serangoon Central Centre have the most quiet?,3
Just wondering about the quietest time to go to Clementi on Tue.,3
What time is it best to go to Clementi ActiveSG gym if I want to avoid crowds?,3
What time is best to go to Ang Mo Kio CC on weekday if I want to avoid crowds?,3
Could you suggest a good time to go to Bukit Canberra on Wednesday when it's the has the lowest number of people?,3
When does Jalan Besar Gym have the has the lowest traffic?,3
When is Jurong East Centre the least busy on Tues?,3
Could I get info on the best time to visit Bukit Canberra ActiveSG gym?,3
Could you suggest a good time to go to Toa Payoh West CC ActiveSG when it's the most quiet?,3
When does Pasir Ris have the least busy?,3
When does Heartbeat Bedok ActiveSG have the has the lowest capacity?,3
What time is it best to go to Hockey Village Boon Lay Centre if I want to avoid crowds?,3
What time is it best to go to Bukit Gombak Centre if I want to avoid crowds?,3
Could you share the quietest time to go to Bishan on Thurs.,3
I'd like to know the best time slot to visit Bukit Canberra Gym.,3
Is it possible to know what time Hockey Village Boon Lay Centre gets the least packed on Sunday.,3
Can I find out when it's not so busy at Woodlands.,3
I'd like to know when it's not so busy at Bukit Canberra ActiveSG.,3
Could I get info on the quietest time to go to Bishan ActiveSG.,3
What time is it best to go to Enabling Village Centre if I want to avoid crowds?,3
When is Clementi Centre the has the lowest traffic?,3
When does Bishan Gym have the least packed on Friday?,3
Could you suggest a good time to go to Heartbeat Bedok when it's the least busy?,3
Can I find out what time Jurong West Gym gets the least full on Sat.,3
What time is best to go to Bukit Batok ActiveSG on Tues if I want to avoid crowds?,3
When is Toa Payoh ActiveSG gym the least packed?,3
Could you suggest a good time to go to Bishan when it's the least busy?,3
Could you suggest a good time to go to Ang Mo Kio CC when it's the most quiet?,3
When is Katong Gym the least busy on Wednesday?,3
Any idea about what time Bishan Centre usually gets the least packed.,3
Could you suggest a good time to go to Delta Gym when it's the least occupied?,3
Do you happen to know when it's not so busy at Heartbeat Bedok on Friday.,3
I'd like to know the best time slot to visit Kallang Basin ActiveSG.,3
What's when it's not so busy at Pasir Ris ActiveSG on Tue.,3
When does Toa Payoh Gym have the least crowded?,3
When does Pasir Ris ActiveSG have the has the lowest crowd on weekends?,3
Do you happen to know the quietest time to go to Bukit Batok ActiveSG gym on Thurs.,3
Could I get info on what time Sengkang ActiveSG gets the has the lowest crowd on weekends.,3
Do you happen to know when Bishan ActiveSG is the has the lowest traffic.,3
I'd appreciate knowing what time Jurong West Gym usually gets the least packed.,3
When is Katong ActiveSG gym the has the lowest traffic on Sun?,3
Any idea about the best time to visit Enabling Village Gym on Friday?,3
What time is it best to go to Bukit Canberra ActiveSG gym if I want to avoid crowds?,3
Do you know when it's not so busy at Serangoon Central Centre.,3
When is Fernvale Square the least packed?,3
Could you suggest a good time to go to Clementi ActiveSG when it's the has the lowest crowd?,3
When does Choa Chu Kang ActiveSG gym have the most quiet on Tuesday?,3
May I know when Choa Chu Kang Gym is the least packed on Wednesday.,3
Can I find out when it's not so busy at Tampines Gym on Thur.,3
Could you share when Pasir Ris ActiveSG gym is the has the lowest traffic.,3
Can I find out the best time to visit Toa Payoh West CC Centre on Tue?,3
Do you happen to know when Tampines is the most quiet.,3
I'd like to know the best time slot to visit Jurong West ActiveSG gym.,3
When is Delta ActiveSG the least packed?,3
Can I find out when Enabling Village ActiveSG is the least busy.,3
Can you tell me the best time to visit Ang Mo Kio CC ActiveSG?,3
Do you happen to know the quietest time to go to Senja-Cashew ActiveSG gym.,3
Could you suggest a good time to go to Jurong West ActiveSG when it's the least busy?,3
Can I find out what time Katong usually gets the least packed.,3
When is Jurong West ActiveSG gym the most quiet?,3
What's when Bukit Batok Gym is the most quiet on weekends.,3
When does Bukit Batok ActiveSG have the has the lowest number of people on Thur?,3
I'd like to know the best time slot to visit Bukit Gombak ActiveSG gym on Thur.,3
Can you tell me the quietest time to go to Bukit Gombak ActiveSG gym.,3
When does Yio Chu Kang Centre have the has the lowest crowd?,3
Could you suggest a good time to go to Toa Payoh West CC ActiveSG gym when it's the least packed?,3
